{
  "$schema": "https://json-schema.org/draft/2020-12/schema",
  "$id": "urbe/exterior/building-request",
  "title": "BuildingRequest",
  "description": "Input to the exterior generator. Units: meters. Building-local space, right-handed, +Y up, XZ floor plane, CCW polygons. Outputs share the footprint's coordinate frame, ground at Y=0.",
  "type": "object",
  "required": ["seed", "buildingId", "parcel", "building", "theme"],
  "additionalProperties": false,
  "properties": {
    "seed": { "type": "string", "minLength": 1 },
    "buildingId": { "type": "string", "minLength": 1 },
    "parcel": {
      "type": "object",
      "required": ["footprint", "accessPoint", "maxHeight"],
      "additionalProperties": false,
      "properties": {
        "footprint": {
          "type": "array",
          "minItems": 3,
          "items": { "$ref": "#/$defs/point2" },
          "description": "CCW simple polygon [x, z], first point not repeated; the buildable boundary, structure never exceeds it"
        },
        "accessPoint": {
          "$ref": "#/$defs/point2",
          "description": "street access point from atlas; the main entrance lands on the facade nearest it"
        },
        "streetAccess": {
          "type": "object", "required": ["edgeId", "path"], "additionalProperties": false,
          "description": "Named Atlas access street and unchanged centerline. The nearest segment to accessPoint determines the street-facing side; every segment must have positive length and the access point must be off that segment's line.",
          "properties": {
            "edgeId": { "type": "string", "minLength": 1 },
            "path": { "type": "array", "minItems": 2, "items": { "$ref": "#/$defs/point2" } }
          }
        },
        "maxHeight": { "type": "number", "exclusiveMinimum": 0 },
        "buildingGrid": {
          "type": "object",
          "required": ["origin", "angle", "spacing"],
          "additionalProperties": false,
          "description": "Shared construction grid from Atlas meta.buildingGrid. Rectangular plate bounds and setbacks retain its phase; aperture-bound parcel vertices remain exact.",
          "properties": {
            "origin": { "$ref": "#/$defs/point2" },
            "angle": { "type": "number", "description": "Rotation in radians." },
            "spacing": { "type": "number", "exclusiveMinimum": 0, "description": "Cell size in metres." }
          }
        }
      }
    },
    "building": {
      "type": "object",
      "required": ["type", "tier", "floors"],
      "additionalProperties": false,
      "properties": {
        "type": { "enum": ["residential", "hotel", "offices", "corpo", "hospital", "clinic", "police", "military", "factory", "commerce", "mall", "restaurant", "coffee_shop"], "description": "atlas parcel types, consumed verbatim" },
        "tier": { "enum": ["poor", "mid", "rich", "high_rich"], "description": "atlas tiers, consumed verbatim" },
        "floors": { "type": "integer", "minimum": 1 },
        "basements": { "type": "integer", "minimum": 0, "default": 0 },
        "floorKinds": {
          "type": "array",
          "items": { "type": "string" },
          "description": "optional slot label per above-ground floor, length must equal floors (e.g. lobby, office, restaurant); synthesized when absent"
        }
      }
    },
    "theme": { "type": "string", "minLength": 1, "description": "lowercase slug; material keys are theme/kind/tier" },
    "apertures": {
      "type": "array",
      "default": [],
      "description": "connections' aperture schema verbatim (../connections/schemas/aperture.schema.json). Face i = vertical quad over parcel footprint segment i -> i+1; face-local frame origin at vertex i at y=0, U along the segment, V along +Y. Exterior reads id, face, kind, base, cut (u/width/height cross-checked); a floor plate lands exactly at each base. wire-anchor cuts no hole: node anchor:<id> emitted at the cut center with its mount plate.",
      "items": {
        "type": "object",
        "required": ["id", "buildingId", "floor", "face", "kind", "u", "base", "width", "height", "shape", "cut", "linkId"],
        "properties": {
          "id": { "type": "string" },
          "buildingId": { "type": "string" },
          "floor": { "type": "integer", "description": "advisory; base is authoritative" },
          "face": { "type": "integer", "minimum": 0, "description": "parcel footprint segment index" },
          "kind": { "enum": ["bridge", "ac-tube", "wire-anchor", "tunnel"] },
          "u": { "type": "number", "description": "face-local U of the opening center" },
          "base": { "type": "number", "description": "absolute y of the opening bottom" },
          "width": { "type": "number", "exclusiveMinimum": 0 },
          "height": { "type": "number", "exclusiveMinimum": 0 },
          "shape": { "enum": ["rect", "circle"] },
          "cut": {
            "type": "object",
            "required": ["polygon", "axisDir"],
            "properties": {
              "polygon": {
                "type": "array",
                "minItems": 3,
                "items": { "$ref": "#/$defs/point3" },
                "description": "world-space loop, every vertex on the face plane"
              },
              "axisDir": { "$ref": "#/$defs/point3" }
            }
          },
          "linkId": { "type": "string" }
        }
      }
    },
    "options": {
      "type": "object",
      "additionalProperties": false,
      "not": { "required": ["doorMotion", "openFront"], "properties": { "doorMotion": { "const": "pocket" }, "openFront": { "const": "on" } } },
      "properties": {
        "minimumClearHeight": { "type": "number", "exclusiveMinimum": 0, "default": 4, "description": "Minimum clear height for all floors. Slab/ceiling allowance is additional; fixed connection elevations remain constraints." },
        "preferredFloorHeight": { "type": "number", "exclusiveMinimum": 0, "description": "Preferred total upper-storey pitch in metres, including the slab/ceiling allowance. Must lie between the active minimum floor height and family maximum. Existing module snapping, envelope and fixed connection elevations constrain the final heights. Omission preserves the family default; ground and basement preferences are unchanged." },
        "architecture": { "enum": ["auto", "rounded-corner", "chamfered-corners", "terrace-blocks", "paired-rounded", "paired-rectangular", "garden-taper", "corporate-sectors", "faceted-bays", "white-grid", "balcony-grid", "mirror-shutters", "mirror-frame", "residential-courtyard", "residential-serviced", "residential-megablock", "industrial-framed", "industrial-solid", "service-storage"], "description": "Dimensioned facade composition on a 0.5 m grid. Modular families preserve fixed rectangular aperture faces." },
        "shape": { "enum": ["auto", "box", "rounded-box", "octagon", "cylinder", "pyramid", "setback"], "default": "auto", "description": "Omitted and auto produce rectangular plates. Other shapes require explicit selection; aperture-bound parcel faces stay exact." },
        "exteriorStyle": { "enum": ["residential-salvaged", "residential-weathered", "residential-modest", "premium-obsidian", "premium-office", "premium-mineral", "civic-utility", "civic-institutional", "civic-industrial"], "description": "Coordinated facade geometry and material set. Omission selects a compatible set by seed, use and tier." },
        "glb": { "enum": ["named", "merged"], "default": "named", "description": "named = contract node per part (canonical, inspectable); merged = one mesh per material key for runtime scale. Same blueprint either way." },
        "balconies": { "enum": ["auto", "on", "off"], "default": "auto" },
        "balconyStyle": { "enum": ["auto", "bay", "full"], "default": "auto", "description": "bay keeps one landing per door; full joins compatible doors on a face into one long band; auto selects by family, tier and seed" },
        "openFront": { "enum": ["auto", "on", "off"], "default": "auto", "description": "permanently open street frontage for eligible compact commerce, restaurant and coffee-shop buildings" },
        "entranceLayout": { "enum": ["single", "repeated"], "default": "single", "description": "one public entrance by default; repeated fits coordinated doors along eligible long frontages when no open frontage is selected" },
        "doorMotion": { "enum": ["swing", "pocket"], "default": "swing", "description": "Ground public entrances only. Pocket requires complete opaque wall cassettes and replaces automatic open frontage; explicit openFront:on conflicts. Loading shutters, balcony doors and roof doors retain their own motion." },
        "fireEscape": { "oneOf": [{ "type": "boolean" }, { "enum": ["auto", "on", "off"] }], "default": "auto", "description": "auto lets the rule decide (a seeded few of the eligible buildings wear one); on forces it where the building is eligible, off never" },
        "windows": { "enum": ["auto", "none"], "default": "auto" },
        "signage": {
          "oneOf": [
            { "type": "null" },
            {
              "type": "object",
              "required": ["mode", "text"],
              "additionalProperties": false,
              "properties": {
                "mode": { "const": "marquee" },
                "text": { "type": "string", "minLength": 1, "maxLength": 40 }
              }
            },
            {
              "description": "the same band, blank: N letter cells the consumer letters at runtime",
              "type": "object",
              "required": ["mode", "cells"],
              "additionalProperties": false,
              "properties": {
                "mode": { "const": "marquee" },
                "cells": { "type": "integer", "minimum": 1, "maximum": 40 }
              }
            },
            {
              "type": "object",
              "required": ["mode", "ratio"],
              "additionalProperties": false,
              "properties": {
                "mode": { "const": "logo" },
                "ratio": { "enum": ["1:1", "3:2", "16:9"] }
              }
            }
          ],
          "default": null
        },
        "adScreens": { "enum": ["auto", "on", "off"], "default": "off" },
        "roofArtifacts": { "enum": ["auto", "off"], "default": "auto" },
        "facadeServices": {
          "enum": ["auto", "on", "off"],
          "default": "auto",
          "description": "dimensioned facade-local pipe and duct networks with attached junction units; auto is limited to compatible solid service facades"
        },
        "hangingClothes": {
          "enum": ["auto", "on", "off"],
          "default": "auto",
          "description": "supported clotheslines clear of openings and access routes; auto is limited to poor and mid residential facades"
        },
        "windowDamage": {
          "enum": ["off", "sparse"],
          "default": "off",
          "description": "explicit opt-in pane damage; sparse selects at most one window per forty candidates and preserves its fitted frame"
        },
        "coreAdjacency": { "$ref": "blueprint.schema.json#/$defs/coreAdjacency" },
        "curtains": {
          "type": "object",
          "additionalProperties": false,
          "properties": {
            "profile": { "enum": ["day", "night"], "default": "day" },
            "sunAzimuthDeg": { "type": "number", "minimum": 0, "exclusiveMaximum": 360, "default": 180, "description": "facades facing this azimuth bias closed" },
            "overrides": {
              "type": "array",
              "description": "exact per-opening controls; openPercent 30 produces closurePercent 70",
              "items": {
                "type": "object",
                "required": ["openingId", "openPercent"],
                "additionalProperties": false,
                "properties": {
                  "openingId": { "type": "string", "minLength": 1 },
                  "openPercent": { "type": "number", "minimum": 0, "maximum": 100 }
                }
              }
            }
          }
        }
      }
    }
  },
  "$defs": {
    "point2": {
      "type": "array",
      "prefixItems": [{ "type": "number" }, { "type": "number" }],
      "minItems": 2,
      "maxItems": 2
    },
    "point3": {
      "type": "array",
      "prefixItems": [{ "type": "number" }, { "type": "number" }, { "type": "number" }],
      "minItems": 3,
      "maxItems": 3
    }
  }
}
