{
  "seed": "rung-800:p30",
  "buildingId": "p30",
  "parcel": {
    "footprint": [
      [
        341.883,
        411.706
      ],
      [
        342.739,
        412.309
      ],
      [
        361.16,
        422.993
      ],
      [
        355.059,
        435.095
      ],
      [
        349.039,
        432.04
      ],
      [
        333.796,
        421.681
      ],
      [
        330.097,
        418.411
      ],
      [
        338.149,
        408.541
      ]
    ],
    "accessPoint": [
      337.906,
      405.713
    ],
    "maxHeight": 136.9
  },
  "building": {
    "type": "residential",
    "tier": "high_rich",
    "floors": 32,
    "basements": 1
  },
  "theme": "cyberpunk",
  "apertures": [
    {
      "buildingId": "p30",
      "floor": 19,
      "face": 6,
      "kind": "bridge",
      "u": 6.368901082604449,
      "base": 72,
      "width": 4.0016974547947335,
      "height": 3.1999999999999886,
      "shape": "rect",
      "cut": {
        "polygon": [
          [
            335.38780484969436,
            72,
            411.92562445771443
          ],
          [
            332.8581951503056,
            72,
            415.02637554228556
          ],
          [
            332.8581951503056,
            75.19999999999999,
            415.02637554228556
          ],
          [
            335.38780484969436,
            75.19999999999999,
            411.92562445771443
          ]
        ],
        "axisDir": [
          -0.7561202072916503,
          0,
          -0.6544327559995998
        ]
      },
      "id": "l26b",
      "linkId": "l26"
    },
    {
      "buildingId": "p30",
      "floor": 2,
      "face": 1,
      "kind": "wire-anchor",
      "u": 14.872122663408021,
      "base": 7.5,
      "width": 0.11238171468834857,
      "height": 0.09999999999999964,
      "shape": "circle",
      "cut": {
        "polygon": [
          [
            355.65251156218704,
            7.55,
            419.7987105222521
          ],
          [
            355.6459994522516,
            7.575,
            419.79493356212237
          ],
          [
            355.6282080370436,
            7.5933012701892215,
            419.78461471514976
          ],
          [
            355.60390451190005,
            7.6,
            419.77051890804734
          ],
          [
            355.57960098675653,
            7.5933012701892215,
            419.7564231009449
          ],
          [
            355.5618095715485,
            7.575,
            419.7461042539723
          ],
          [
            355.55529746161307,
            7.55,
            419.74232729384255
          ],
          [
            355.5618095715485,
            7.5249999999999995,
            419.7461042539723
          ],
          [
            355.57960098675653,
            7.506698729810778,
            419.7564231009449
          ],
          [
            355.60390451190005,
            7.5,
            419.77051890804734
          ],
          [
            355.6282080370436,
            7.506698729810778,
            419.78461471514976
          ],
          [
            355.6459994522516,
            7.5249999999999995,
            419.79493356212237
          ]
        ],
        "axisDir": [
          0.051717424615231586,
          0,
          -0.9986617585504952
        ]
      },
      "id": "l139a",
      "linkId": "l139"
    },
    {
      "buildingId": "p30",
      "floor": 2,
      "face": 1,
      "kind": "wire-anchor",
      "u": 0.8802163499312678,
      "base": 7.5,
      "width": 0.10248040705093564,
      "height": 0.09999999999999964,
      "shape": "circle",
      "cut": {
        "polygon": [
          [
            343.54474238717705,
            7.55,
            412.776322711286
          ],
          [
            343.5388040218585,
            7.575,
            412.7728785174278
          ],
          [
            343.5225801060944,
            7.5933012701892215,
            412.7634688048159
          ],
          [
            343.50041782501165,
            7.6,
            412.75061489834565
          ],
          [
            343.4782555439289,
            7.5933012701892215,
            412.73776099187546
          ],
          [
            343.4620316281648,
            7.575,
            412.7283512792635
          ],
          [
            343.45609326284625,
            7.55,
            412.7249070854053
          ],
          [
            343.4620316281648,
            7.5249999999999995,
            412.7283512792635
          ],
          [
            343.4782555439289,
            7.506698729810778,
            412.73776099187546
          ],
          [
            343.50041782501165,
            7.5,
            412.75061489834565
          ],
          [
            343.5225801060944,
            7.506698729810778,
            412.7634688048159
          ],
          [
            343.5388040218585,
            7.5249999999999995,
            412.7728785174278
          ]
        ],
        "axisDir": [
          0.30040131213016785,
          0,
          -0.9538129018159031
        ]
      },
      "id": "l140a",
      "linkId": "l140"
    },
    {
      "buildingId": "p30",
      "floor": -2,
      "face": 2,
      "kind": "tunnel",
      "u": 6.776440898436277,
      "base": -4,
      "width": 3.0003430125356667,
      "height": 2.8,
      "shape": "rect",
      "cut": {
        "polygon": [
          [
            358.7848210495684,
            -4,
            427.7044269231476
          ],
          [
            357.43417895043166,
            -4,
            430.3835730768524
          ],
          [
            357.43417895043166,
            -1.2000000000000002,
            430.3835730768524
          ],
          [
            358.7848210495684,
            -1.2000000000000002,
            427.7044269231476
          ]
        ],
        "axisDir": [
          0.8860377583208233,
          0,
          0.4636130831089759
        ]
      },
      "id": "l253a",
      "linkId": "l253"
    }
  ],
  "options": {
    "glb": "named"
  }
}