{
  "seed": "urbe:p15",
  "buildingId": "p15",
  "parcel": {
    "footprint": [
      [
        788.169,
        302.228
      ],
      [
        787.629,
        309.405
      ],
      [
        764.962,
        307.968
      ],
      [
        758.985,
        307.066
      ],
      [
        762.036,
        258.916
      ],
      [
        786.448,
        257.581
      ]
    ],
    "accessPoint": [
      787.259,
      256.563
    ],
    "maxHeight": 138
  },
  "building": {
    "type": "corpo",
    "tier": "high_rich",
    "floors": 27,
    "basements": 1
  },
  "theme": "cyberpunk",
  "apertures": [
    {
      "buildingId": "p15",
      "floor": 8,
      "face": 1,
      "kind": "bridge",
      "u": 11.356252220693303,
      "base": 40,
      "width": 4.0035982707256945,
      "height": 3.200000000000003,
      "shape": "rect",
      "cut": {
        "polygon": [
          [
            774.2977114638054,
            40,
            308.5598479451841
          ],
          [
            778.2932885361945,
            40,
            308.8131520548159
          ],
          [
            778.2932885361945,
            43.2,
            308.8131520548159
          ],
          [
            774.2977114638054,
            43.2,
            308.5598479451841
          ]
        ],
        "axisDir": [
          -0.10551494863128755,
          0,
          0.9944177168651698
        ]
      },
      "id": "l34b",
      "linkId": "l34"
    },
    {
      "buildingId": "p15",
      "floor": 4,
      "face": 1,
      "kind": "ac-tube",
      "u": 15.444503020142868,
      "base": 20,
      "width": 2.0022302800903784,
      "height": 2.3999999999999986,
      "shape": "rect",
      "cut": {
        "polygon": [
          [
            771.2163305914376,
            20,
            308.3645003335199
          ],
          [
            773.2145494085623,
            20,
            308.4911796664801
          ],
          [
            773.2145494085623,
            22.4,
            308.4911796664801
          ],
          [
            771.2163305914376,
            22.4,
            308.3645003335199
          ]
        ],
        "axisDir": [
          -0.11029048536486813,
          0,
          0.9938993957327784
        ]
      },
      "id": "l102b",
      "linkId": "l102"
    },
    {
      "buildingId": "p15",
      "floor": 1,
      "face": 4,
      "kind": "wire-anchor",
      "u": 2.1305169882714217,
      "base": 7.5,
      "width": 0.12229927744207458,
      "height": 0.09999999999999964,
      "shape": "circle",
      "cut": {
        "polygon": [
          [
            764.1022799655929,
            7.55,
            258.80300295944346
          ],
          [
            764.110460240986,
            7.575,
            258.80255561110454
          ],
          [
            764.1328091689796,
            7.5933012701892215,
            258.80133343271393
          ],
          [
            764.1633383723663,
            7.6,
            258.7996639059844
          ],
          [
            764.193867575753,
            7.5933012701892215,
            258.7979943792549
          ],
          [
            764.2162165037466,
            7.575,
            258.79677220086427
          ],
          [
            764.2243967791397,
            7.55,
            258.79632485252534
          ],
          [
            764.2162165037466,
            7.5249999999999995,
            258.79677220086427
          ],
          [
            764.193867575753,
            7.506698729810778,
            258.7979943792549
          ],
          [
            764.1633383723663,
            7.5,
            258.7996639059844
          ],
          [
            764.1328091689796,
            7.506698729810778,
            258.80133343271393
          ],
          [
            764.110460240986,
            7.5249999999999995,
            258.80255561110454
          ]
        ],
        "axisDir": [
          0.5301851750556171,
          0,
          -0.8478818786548303
        ]
      },
      "id": "l151b",
      "linkId": "l151"
    },
    {
      "buildingId": "p15",
      "floor": 1,
      "face": 4,
      "kind": "wire-anchor",
      "u": 13.43451269383307,
      "base": 7.5,
      "width": 0.151322731499123,
      "height": 0.09999999999999964,
      "shape": "circle",
      "cut": {
        "polygon": [
          [
            775.3749206457474,
            7.55,
            258.1865448524466
          ],
          [
            775.3850422232642,
            7.575,
            258.1859913416329
          ],
          [
            775.4126948872931,
            7.5933012701892215,
            258.18447912196723
          ],
          [
            775.4504691288389,
            7.6,
            258.1824133914878
          ],
          [
            775.4882433703847,
            7.5933012701892215,
            258.1803476610084
          ],
          [
            775.5158960344136,
            7.575,
            258.1788354413427
          ],
          [
            775.5260176119305,
            7.55,
            258.17828193052895
          ],
          [
            775.5158960344136,
            7.5249999999999995,
            258.1788354413427
          ],
          [
            775.4882433703847,
            7.506698729810778,
            258.1803476610084
          ],
          [
            775.4504691288389,
            7.5,
            258.1824133914878
          ],
          [
            775.4126948872931,
            7.506698729810778,
            258.18447912196723
          ],
          [
            775.3850422232642,
            7.5249999999999995,
            258.1859913416329
          ]
        ],
        "axisDir": [
          0.7133228443130829,
          0,
          -0.7008355868398044
        ]
      },
      "id": "l152b",
      "linkId": "l152"
    },
    {
      "buildingId": "p15",
      "floor": -1,
      "face": 1,
      "kind": "tunnel",
      "u": 7.268001421243623,
      "base": -4,
      "width": 3.0021214452631817,
      "height": 2.8,
      "shape": "rect",
      "cut": {
        "polygon": [
          [
            778.8775066484775,
            -4,
            308.85018922018185
          ],
          [
            781.8736133515226,
            -4,
            309.0401307798181
          ],
          [
            781.8736133515226,
            -1.2000000000000002,
            309.0401307798181
          ],
          [
            778.8775066484775,
            -1.2000000000000002,
            308.85018922018185
          ]
        ],
        "axisDir": [
          -0.10073630397095859,
          0,
          0.9949131605634085
        ]
      },
      "id": "l350b",
      "linkId": "l350"
    }
  ],
  "options": {
    "glb": "merged"
  }
}
