{
  "seed": "863c39de-9e8a-45e3-94b2-f9f296eafef9:p67",
  "buildingId": "p67",
  "parcel": {
    "footprint": [
      [
        188.5,
        411.5
      ],
      [
        322,
        411.5
      ],
      [
        322,
        465
      ],
      [
        188.5,
        465
      ]
    ],
    "accessPoint": [
      323.2,
      438.3
    ],
    "streetAccess": {
      "edgeId": "e20",
      "path": [
        [
          331.6,
          329.9
        ],
        [
          331.6,
          478.2
        ]
      ]
    },
    "maxHeight": 101.2,
    "buildingGrid": {
      "origin": [
        0,
        0
      ],
      "angle": 0,
      "spacing": 0.5
    }
  },
  "building": {
    "type": "corpo",
    "tier": "rich",
    "floors": 22,
    "basements": 1
  },
  "theme": "cyberpunk",
  "apertures": [
    {
      "buildingId": "p67",
      "floor": 1,
      "face": 1,
      "kind": "wire-anchor",
      "u": 49.80924330595883,
      "base": 7.5,
      "width": 0.10640636282471405,
      "height": 0.09999999999999964,
      "shape": "circle",
      "cut": {
        "polygon": [
          [
            322,
            7.55,
            461.2560401245465
          ],
          [
            322,
            7.575,
            461.26316799929356
          ],
          [
            322,
            7.5933012701892215,
            461.2826417152527
          ],
          [
            322,
            7.6,
            461.30924330595883
          ],
          [
            322,
            7.5933012701892215,
            461.335844896665
          ],
          [
            322,
            7.575,
            461.3553186126241
          ],
          [
            322,
            7.55,
            461.3624464873712
          ],
          [
            322,
            7.5249999999999995,
            461.3553186126241
          ],
          [
            322,
            7.506698729810778,
            461.335844896665
          ],
          [
            322,
            7.5,
            461.30924330595883
          ],
          [
            322,
            7.506698729810778,
            461.2826417152527
          ],
          [
            322,
            7.5249999999999995,
            461.26316799929356
          ]
        ],
        "axisDir": [
          0.939793423488437,
          0,
          -0.3417430630867044
        ]
      },
      "id": "l28b",
      "linkId": "l28"
    },
    {
      "buildingId": "p67",
      "floor": -1,
      "face": 0,
      "kind": "tunnel",
      "u": 66.74999999999999,
      "base": -4.5,
      "width": 3.2467957916203716,
      "height": 2.8,
      "shape": "rect",
      "cut": {
        "polygon": [
          [
            253.6266021041898,
            -4.5,
            411.5
          ],
          [
            256.87339789581017,
            -4.5,
            411.5
          ],
          [
            256.87339789581017,
            -1.7000000000000002,
            411.5
          ],
          [
            253.6266021041898,
            -1.7000000000000002,
            411.5
          ]
        ],
        "axisDir": [
          -0.3824217240334223,
          0,
          -0.9239878922298197
        ]
      },
      "id": "l41a",
      "linkId": "l41"
    }
  ],
  "options": {
    "glb": "merged",
    "architecture": "garden-taper"
  }
}
