{
  "seed": "urbe-small:p0",
  "buildingId": "p0",
  "parcel": {
    "footprint": [
      [143.539, 320.586],
      [146.094, 362.859],
      [144.926, 377.513],
      [134.862, 384.048],
      [133.887, 382.546],
      [107.453, 341.84],
      [112.27, 326.375],
      [112.555, 326.179],
      [116.289, 322.692],
      [120.361, 325.571],
      [121.502, 326.253],
      [123.749, 326.998],
      [126.241, 327.092],
      [128.66, 326.485],
      [130.578, 325.364],
      [137.391, 319.961]
    ],
    "accessPoint": [144.486, 319.678],
    "maxHeight": 68
  },
  "building": { "type": "offices", "tier": "mid", "floors": 17 },
  "theme": "cyberpunk",
  "apertures": [],
  "options": {
    "glb": "named"
  }
}
