{
  "seed": "urbe:p2",
  "buildingId": "p2",
  "parcel": {
    "footprint": [[285.455, 601.708], [274.709, 664.206], [272.874, 674.867], [246.153, 670.865], [257.257, 596.704]],
    "accessPoint": [286.61, 600.897],
    "maxHeight": 35.2
  },
  "building": { "type": "hotel", "tier": "poor", "floors": 9 },
  "theme": "cyberpunk",
  "apertures": [{
    "buildingId": "p2",
    "floor": 2,
    "face": 4,
    "kind": "wire-anchor",
    "u": 12.738153174342607,
    "base": 7.5,
    "width": 0.11458503230601558,
    "height": 0.09999999999999964,
    "shape": "circle",
    "cut": {
      "polygon": [
        [269.74278443871424, 7.55, 598.9197197436458],
        [269.7503421005385, 7.575, 598.9210609217354],
        [269.77099001662884, 7.5933012701892215, 598.924725088418],
        [269.79919559454345, 7.6, 598.9297304331901],
        [269.8274011724581, 7.5933012701892215, 598.9347357779623],
        [269.8480490885484, 7.575, 598.9383999446449],
        [269.8556067503727, 7.55, 598.9397411227344],
        [269.8480490885484, 7.5249999999999995, 598.9383999446449],
        [269.8274011724581, 7.506698729810778, 598.9347357779623],
        [269.79919559454345, 7.5, 598.9297304331901],
        [269.77099001662884, 7.506698729810778, 598.924725088418],
        [269.7503421005385, 7.5249999999999995, 598.9210609217354]
      ],
      "axisDir": [0.6332093674014035, 0, -0.7739805533959586]
    },
    "id": "l107b",
    "linkId": "l107"
  }],
  "options": { "glb": "merged", "signage": { "mode": "marquee", "text": "HOTEL" } }
}
